Product Code:,Animal Species,Establishment Code,Establishment Name,Subsidiaries,Product True Name,Agent(s):,Trade Name(s):,Distributor(s):,Usage,Dosage_and_TimePeriod,Dosage_Source_Reference,Usage_Improved
"<a href=""https://www.aphis.usda.govhttps://www.aphis.usda.gov/aphis/ourfocus/animalhealth/veterinary-biologics/product-summaries/vet-label-data/4193dd94-e5b3-491a-99a4-dce43f77dd61"">16D120</a>",Feline,165A,Intervet Inc.,Merck Animal Health,"Feline Rhinotracheitis-Calici-Panleukopenia Vaccine, Modified Live Virus","Calicivirus, Feline; Herpesvirus, Feline (Rhinotracheitis); Parvovirus, Feline (Panleukopenia)",Nobivac Feline 1 HCP; Nobivac HCP; Quantum Cat HCP,Intervet S.A.,"A vaccine for felines that helps protect against calicivirus, feline; herpesvirus, feline (rhinotracheitis); parvovirus, feline (panleukopenia).",Label not found in quick search; please consult the USDA/APHIS product summary or the manufacturer's product insert for exact dosage and schedule.,Label not located,"A vaccine for felines that helps protect against calicivirus, feline; herpesvirus, feline (rhinotracheitis); parvovirus, feline (panleukopenia)."
"<a href=""https://www.aphis.usda.govhttps://www.aphis.usda.gov/aphis/ourfocus/animalhealth/veterinary-biologics/product-summaries/vet-label-data/f6a06d92-fc99-469c-8986-e6e72e5ce17a"">127500</a>",Chicken,190,Zoetis Inc.,Not Applicable,"Bursal Disease Vaccine, Killed Virus","Bursal Disease (Birnavirus, Avian)",Bursine-K,No distributor specified,"A vaccine for chickens that helps protect against bursal disease (birnavirus, avian).",Label not found in quick search; please consult the USDA/APHIS product summary or the manufacturer's product insert for exact dosage and schedule.,Label not located,"A vaccine for chickens that helps protect against bursal disease (birnavirus, avian)."
"<a href=""https://www.aphis.usda.govhttps://www.aphis.usda.gov/aphis/ourfocus/animalhealth/veterinary-biologics/product-summaries/vet-label-data/58b60a0e-7636-489c-8636-5758109944ae"">118725</a>",Bovine,190,Zoetis Inc.,Not applicable,"Bovine Rhinotracheitis-Virus Diarrhea-Parainfluenza 3-Respiratory Syncytial Virus Vaccine, Modified Live &amp; Killed Virus","Bovine Virus Diarrhea Virus (Untyped); Herpesvirus, Bovine (IBR); Parainfluenza 3 Virus, Bovine; Respiratory Syncytial Virus, Bovine",CattleMaster Gold FP 5,Zoetis Ecuador Cia Ltda.; Zoetis Mexico,"A vaccine for bovines that helps protect against bovine virus diarrhea virus (untyped); herpesvirus, bovine (ibr); parainfluenza 3 virus, bovine; respiratory syncytial virus, bovine.","Commonly 2 mL subcutaneous or intramuscular; primary/booster schedules vary (often booster in 2-4 weeks, then annual), follow label.",Boehringer/Ingelheim / Merck product inserts.,"A vaccine for bovines that helps protect against bovine virus diarrhea virus (untyped); herpesvirus, bovine (ibr); parainfluenza 3 virus, bovine; respiratory syncytial virus, bovine."
"<a href=""https://www.aphis.usda.govhttps://www.aphis.usda.gov/aphis/ourfocus/animalhealth/veterinary-biologics/product-summaries/vet-label-data/516f7d0f-5f99-4907-a137-c5b97901c3ed"">1A91R2</a>",Chicken,368,"Ceva Animal Health, LLC",Biomune Company,"Bursal Disease-Marek's Disease-Newcastle Disease Vaccine, Serotypes 2 &amp; 3, Live Virus, Live Marek's Disease Vector","Bursal Disease (Birnavirus, Avian); Paramyxovirus, Avian (Newcastle); Herpesvirus, Chicken [Mareks, Serotype 2]; Herpesvirus, Turkey [Mareks, Serotype 3]",Ultifend IBD ND + SB1,No distributor specified,"A vaccine for chickens that helps protect against bursal disease (birnavirus, avian); paramyxovirus, avian (newcastle); herpesvirus, chicken [mareks, serotype 2]; herpesvirus, turkey [mareks, serotype 3].","Administration varies by product: spray, drinking water, or individual injection. Follow product insert (commonly rehydrate and administer per 1000-5000 birds ratio); revaccinate per label.",Zoetis product inserts / USDA APHIS product summaries.,"A vaccine for chickens that helps protect against bursal disease (birnavirus, avian); paramyxovirus, avian (newcastle); herpesvirus, chicken [mareks, serotype 2]; herpesvirus, turkey [mareks, serotype 3]."
"<a href=""https://www.aphis.usda.govhttps://www.aphis.usda.gov/aphis/ourfocus/animalhealth/veterinary-biologics/product-summaries/vet-label-data/ac224abe-28aa-4bf5-94e8-3451749974f3"">16L106</a>",Chicken,368,"Ceva Animal Health, LLC",Biomune Company,"Marek's Disease Vaccine, Serotype 3, Live Virus","Herpesvirus, Turkey [Mareks, Serotype 3]",CEVAC MD HVT,Biomune Company; CEVA Salud Animal S.A.C.-Peru; Ceva Saude Animal LTDA,"A vaccine for chickens that helps protect against herpesvirus, turkey [mareks, serotype 3].",Label not found in quick search; please consult the USDA/APHIS product summary or the manufacturer's product insert for exact dosage and schedule.,Label not located,"A vaccine for chickens that helps protect against herpesvirus, turkey [mareks, serotype 3]."
"<a href=""https://www.aphis.usda.govhttps://www.aphis.usda.gov/aphis/ourfocus/animalhealth/veterinary-biologics/product-summaries/vet-label-data/d0bb0086-90b8-4979-b6fc-62cae6efab37"">154101</a>",Swine,124,Boehringer Ingelheim Animal Health USA Inc.,Not applicable,"Erysipelothrix Rhusiopathiae Vaccine, Avirulent Live Culture",Erysipelothrix rhusiopathiae,No trade name assigned,No distributor specified,A vaccine for swines that helps protect against erysipelothrix rhusiopathiae.,"Administer by wing-web method; typical dose extremely small (e.g., 0.01 mL per bird) — follow product insert for exact technique and timing.","Merck/USDA product inserts (Tremvac, AE-Poxine).",A vaccine for swines that helps protect against erysipelothrix rhusiopathiae.
"<a href=""https://www.aphis.usda.govhttps://www.aphis.usda.gov/aphis/ourfocus/animalhealth/veterinary-biologics/product-summaries/vet-label-data/8c43f81b-01ef-4d16-addd-109ed2493285"">742300</a>",Bovine,190,Zoetis Inc,Not Applicable,Clostridium Chauvoei-Septicum-Novyi-Sordellii-Perfringens Types C &amp; D-Haemophilus Somnus Bacterin-Toxoid,Clostridium chauvoei; Clostridium novyi; Clostridium perfringens Type C; Clostridium perfringens Type D; Clostridium septicum; Clostridium sordellii; Histophilus (Haemophilus) somni,Ultrabac 7/Somubac,Zoetis Mexico,A bacterin for bovines that provides immunity against clostridium chauvoei; clostridium novyi; clostridium perfringens type c; clostridium perfringens type d; clostridium septicum; clostridium sordellii; histophilus (haemophilus) somni.,"Administer by wing-web method; typical dose extremely small (e.g., 0.01 mL per bird) — follow product insert for exact technique and timing.","Merck/USDA product inserts (Tremvac, AE-Poxine).",A bacterin for bovines that provides immunity against clostridium chauvoei; clostridium novyi; clostridium perfringens type c; clostridium perfringens type d; clostridium septicum; clostridium sordellii; histophilus (haemophilus) somni.
"<a href=""https://www.aphis.usda.govhttps://www.aphis.usda.gov/aphis/ourfocus/animalhealth/veterinary-biologics/product-summaries/vet-label-data/eebe04fb-b547-4d0c-b3e2-d14cef4752f1"">495521</a>",Mink,368,"Ceva Animal Health, LLC","Biomune Company; United Vaccines, Inc.","Mink Enteritis Vaccine, Killed Virus, Clostridium Botulinum Type C Bacterin-Toxoid","Parvovirus, Mink (Enteritis); Clostridium botulinum Type C",No trade name assigned,"Biomune Company; United Vaccines, Inc.","A vaccine for minks that helps protect against parvovirus, mink (enteritis); clostridium botulinum type c.",Dose and route vary; many bacterins are 1-2 mL IM or SQ with a 2-dose primary series spaced 2-4 weeks apart. Follow specific product label.,Manufacturer product inserts / USDA summaries.,"A vaccine for minks that helps protect against parvovirus, mink (enteritis); clostridium botulinum type c."
"<a href=""https://www.aphis.usda.govhttps://www.aphis.usda.gov/aphis/ourfocus/animalhealth/veterinary-biologics/product-summaries/vet-label-data/8a736d32-8d89-4f1d-b1c7-931951a9e03b"">278500</a>",Chicken,196,Elanco US Inc.,Lohmann Animal Health International,Salmonella Enteritidis Bacterin,Salmonella enteritidis,AviPro 109 SE4; AviPro 109 SE4 Conc,"Ilender Peru S.A.; Laboratories Bimex SRL; Elanco Animal Health; Elanco Colombia SAS; Elanco Salud Animal, S.A. de C.V.; J. Orbe Asesores S.A.C.; TADEC CIA Ltda; Ilender Bolivia S.A.",A bacterin for chickens that provides immunity against salmonella enteritidis.,Dose and route vary; many bacterins are 1-2 mL IM or SQ with a 2-dose primary series spaced 2-4 weeks apart. Follow specific product label.,Manufacturer product inserts / USDA summaries.,A bacterin for chickens that provides immunity against salmonella enteritidis.
"<a href=""https://www.aphis.usda.govhttps://www.aphis.usda.gov/aphis/ourfocus/animalhealth/veterinary-biologics/product-summaries/vet-label-data/f8eaa17b-9d36-4e03-b70f-bfb94263b765"">19E121</a>",Swine,165A,Intervet Inc.,Merck Animal Health; Merck Sharpe and Dohme (MSD),"Porcine Rotavirus Vaccine, Modified Live Virus","Rotavirus, Porcine",ProSystem Rota,No distributor specified,"A vaccine for swines that helps protect against rotavirus, porcine.",Label not found in quick search; please consult the USDA/APHIS product summary or the manufacturer's product insert for exact dosage and schedule.,Label not located,"A vaccine for swines that helps protect against rotavirus, porcine."
"<a href=""https://www.aphis.usda.govhttps://www.aphis.usda.gov/aphis/ourfocus/animalhealth/veterinary-biologics/product-summaries/vet-label-data/a279b11e-00d0-4184-b60c-a32e66da62b2"">118126</a>",Bovine,124,"Boehringer Ingelheim Vetmedica, Inc.",Not Applicable,"Bovine Rhinotracheitis-Virus Diarrhea-Parainfluenza 3-Respiratory Syncytial Virus Vaccine, Modified Live Virus","Herpesvirus, Bovine (IBR); Parainfluenza 3 Virus, Bovine; Respiratory Syncytial Virus, Bovine ; Bovine Virus Diarrhea Virus (Untyped)",Pyramid 5; Pyramid FP 5,Boehringer Ingelheim (Canada) Ltd.,"A vaccine for bovines that helps protect against herpesvirus, bovine (ibr); parainfluenza 3 virus, bovine; respiratory syncytial virus, bovine ; bovine virus diarrhea virus (untyped).","Commonly 2 mL subcutaneous or intramuscular; primary/booster schedules vary (often booster in 2-4 weeks, then annual), follow label.",Boehringer/Ingelheim / Merck product inserts.,"A vaccine for bovines that helps protect against herpesvirus, bovine (ibr); parainfluenza 3 virus, bovine; respiratory syncytial virus, bovine ; bovine virus diarrhea virus (untyped)."
"<a href=""https://www.aphis.usda.govhttps://www.aphis.usda.gov/aphis/ourfocus/animalhealth/veterinary-biologics/product-summaries/vet-label-data/bacf84a2-2747-4b99-a8d1-78ef0785111e"">16L1R0</a>",Chicken,298,"Merial, Inc.",Not applicable,"Marek's Disease Vaccine, Serotype 1, Live Herpesvirus Chimera","Herpesvirus, Chicken (Mareks, Serotype 1)",Prevexxion RN,No distributor specified,"A vaccine for chickens that helps protect against herpesvirus, chicken (mareks, serotype 1).",Label not found in quick search; please consult the USDA/APHIS product summary or the manufacturer's product insert for exact dosage and schedule.,Label not located,"A vaccine for chickens that helps protect against herpesvirus, chicken (mareks, serotype 1)."
"<a href=""https://www.aphis.usda.govhttps://www.aphis.usda.gov/aphis/ourfocus/animalhealth/veterinary-biologics/product-summaries/vet-label-data/4414d30a-b75d-4475-b429-9b0f72a74118"">265811</a>",Chicken,190,Zoetis Inc.,Not Applicable,Avibacterium Paragallinarum Bacterin,Avibacterium (Haemophilus) paragallinarum,Poulvac Coryza ABC IC3,CASAVET; Zoetis Animal Health Ltd Istanbul; Zoetis Belgium SA; Zoetis Import Egypt; Zoetis Panama,A bacterin for chickens that provides immunity against avibacterium (haemophilus) paragallinarum.,Dose and route vary; many bacterins are 1-2 mL IM or SQ with a 2-dose primary series spaced 2-4 weeks apart. Follow specific product label.,Manufacturer product inserts / USDA summaries.,A bacterin for chickens that provides immunity against avibacterium (haemophilus) paragallinarum.
"<a href=""https://www.aphis.usda.govhttps://www.aphis.usda.gov/aphis/ourfocus/animalhealth/veterinary-biologics/product-summaries/vet-label-data/48e02d81-a5a0-4552-b3a6-6738464dc1e4"">830400</a>","Ovine,Caprine,Swine,Bovine",188,Colorado Serum Company,Professional Biological Company,Clostridium Perfringens Types C &amp; D-Tetanus Toxoid,Clostridium perfringens Type C; Clostridium perfringens Type D; Clostridium tetani,Essential 3+T; GoatVac CD-T,"Durvet, Inc","This product is used in ovine,caprine,swine,bovines to help prevent or protect against diseases caused by clostridium perfringens type c; clostridium perfringens type d; clostridium tetani.",Label not found in quick search; please consult the USDA/APHIS product summary or the manufacturer's product insert for exact dosage and schedule.,Label not located,"This product is used in ovine,caprine,swine,bovines to help prevent or protect against diseases caused by clostridium perfringens type c; clostridium perfringens type d; clostridium tetani."
"<a href=""https://www.aphis.usda.govhttps://www.aphis.usda.gov/aphis/ourfocus/animalhealth/veterinary-biologics/product-summaries/vet-label-data/7c60a26a-5f23-4a93-9d74-91600e724e80"">408920</a>",Bovine,213,"Diamond Animal Health, Inc.","Diamond Animal Health, Inc.","Bovine Rhinotracheitis Vaccine, Modified Live Virus, Leptospira Pomona Bacterin","Leptospira pomona; Herpesvirus, Bovine (IBR)",Titanium IBR LP,"Elanco Animal Health; Elanco US, Inc","A vaccine for bovines that helps protect against leptospira pomona; herpesvirus, bovine (ibr).","Commonly 2 mL subcutaneous or intramuscular; primary/booster schedules vary (often booster in 2-4 weeks, then annual), follow label.",Boehringer/Ingelheim / Merck product inserts.,"A vaccine for bovines that helps protect against leptospira pomona; herpesvirus, bovine (ibr)."
"<a href=""https://www.aphis.usda.govhttps://www.aphis.usda.gov/aphis/ourfocus/animalhealth/veterinary-biologics/product-summaries/vet-label-data/d720fc08-3226-4c12-8252-e1acf492042c"">9240D0</a>",Canine,298,"Merial, Inc.",Not applicable,"Canine Melanoma Vaccine, DNA",Immunomodulator,Oncept,No distributor specified,A vaccine for canines that helps protect against immunomodulator.,Administer 1 mL subcutaneously. Primary immunization: 2 doses 3-4 weeks apart; boosters per label/manufacturer.,"Merck/Zoetis product inserts (e.g., Vanguard, Nobivac).",A vaccine for canines that helps protect against immunomodulator.
"<a href=""https://www.aphis.usda.govhttps://www.aphis.usda.gov/aphis/ourfocus/animalhealth/veterinary-biologics/product-summaries/vet-label-data/ad8bb380-4536-4035-9b3c-6438427ec6cb"">14M123</a>",Canine,165A,Intervet Inc.,Not Applicable,"Canine Parainfluenza-Bordetella Bronchiseptica Vaccine, Modified Live Virus, Avirulent Live Culture","Bordetella bronchiseptica; Parainfluenza, Canine",Nobivac Intra-Trac Oral BbPi,Merck Animal Health,"A vaccine for canines that helps protect against bordetella bronchiseptica; parainfluenza, canine.",Administer 1 mL subcutaneously. Primary immunization: 2 doses 3-4 weeks apart; boosters per label/manufacturer.,"Merck/Zoetis product inserts (e.g., Vanguard, Nobivac).","A vaccine for canines that helps protect against bordetella bronchiseptica; parainfluenza, canine."
"<a href=""https://www.aphis.usda.govhttps://www.aphis.usda.gov/aphis/ourfocus/animalhealth/veterinary-biologics/product-summaries/vet-label-data/b8721b73-8a37-4961-9f1c-838664ad7379"">12D5T0</a>",Chicken,190,Zoetis Inc.,Not Applicable,"Bursal Disease-Reovirus Vaccine, Standard &amp; Variant, Killed Virus","Bursal Disease (Birnavirus, Avian);Reovirus, Avian (Unspecified Syndrome)",Poulvac Maternavac IBD-Reo,Zoetis Argentina; Zoetis Colombia S.A.S.; Zoetis Industria Produtos Veterinarios Ltda; Zoetis Mexico,"A vaccine for chickens that helps protect against bursal disease (birnavirus, avian);reovirus, avian (unspecified syndrome).",Inject 0.5 mL subcutaneously per bird; revaccinate 4-6 weeks or as directed on label.,AviPro / manufacturer product inserts.,"A vaccine for chickens that helps protect against bursal disease (birnavirus, avian);reovirus, avian (unspecified syndrome)."
"<a href=""https://www.aphis.usda.govhttps://www.aphis.usda.gov/aphis/ourfocus/animalhealth/veterinary-biologics/product-summaries/vet-label-data/ee1c6f6b-b54e-4b40-aea1-5d7f2e63796b"">155520</a>",Feline,165A,Intervet Inc.,Merck Animal Health,"Feline Leukemia Vaccine, Killed Virus",Feline Leukemia Virus,Nobivac 2-FeLv; Nobivac Feline 2-FeLV; Quantum Cat FeLV,No distributor specified,A vaccine for felines that helps protect against feline leukemia virus.,Label not found in quick search; please consult the USDA/APHIS product summary or the manufacturer's product insert for exact dosage and schedule.,Label not located,A vaccine for felines that helps protect against feline leukemia virus.
"<a href=""https://www.aphis.usda.govhttps://www.aphis.usda.gov/aphis/ourfocus/animalhealth/veterinary-biologics/product-summaries/vet-label-data/f2c1e2ac-e567-4e4d-8399-4b05c561fa0c"">46E528</a>",Canine,124,Boehringer Ingelheim Animal Health USA Inc.,Not applicable,"Canine Coronavirus Vaccine, Killed Virus, Leptospira Canicola-Grippotyphosa-Icterohaemorrhagiae-Pomona Bacterial Extract","Coronavirus, Canine; Leptospira canicola; Leptospira grippotyphosa; Leptospira icterohaemorrhagiae; Leptospira pomona",No trade name assigned,No distributor specified,"A vaccine for canines that helps protect against coronavirus, canine; leptospira canicola; leptospira grippotyphosa; leptospira icterohaemorrhagiae; leptospira pomona.",Administer 1 mL subcutaneously. Primary immunization: 2 doses 3-4 weeks apart; boosters per label/manufacturer.,"Merck/Zoetis product inserts (e.g., Vanguard, Nobivac).","A vaccine for canines that helps protect against coronavirus, canine; leptospira canicola; leptospira grippotyphosa; leptospira icterohaemorrhagiae; leptospira pomona."
"<a href=""https://www.aphis.usda.govhttps://www.aphis.usda.gov/aphis/ourfocus/animalhealth/veterinary-biologics/product-summaries/vet-label-data/85e652cb-a163-4386-ac0c-bdd9e394192d"">716000</a>","Ovine,Bovine",124,Boehringer Ingelheim Animal Health USA Inc.,Not applicable,Clostridium Chauvoei-Septicum-Haemolyticum-Novyi-Sordellii-Perfringens Types C &amp; D Bacterin-Toxoid,Clostridium chauvoei; Clostridium haemolyticum; Clostridium novyi; Clostridium perfringens Type C; Clostridium perfringens Type D; Clostridium septicum; Clostridium sordellii,Bar Vac 8,No distributor specified,"A bacterin for ovine,bovines that provides immunity against clostridium chauvoei; clostridium haemolyticum; clostridium novyi; clostridium perfringens type c; clostridium perfringens type d; clostridium septicum; clostridium sordellii.","Administer by wing-web method; typical dose extremely small (e.g., 0.01 mL per bird) — follow product insert for exact technique and timing.","Merck/USDA product inserts (Tremvac, AE-Poxine).","A bacterin for ovine,bovines that provides immunity against clostridium chauvoei; clostridium haemolyticum; clostridium novyi; clostridium perfringens type c; clostridium perfringens type d; clostridium septicum; clostridium sordellii."
"<a href=""https://www.aphis.usda.govhttps://www.aphis.usda.gov/aphis/ourfocus/animalhealth/veterinary-biologics/product-summaries/vet-label-data/b8bcc1a1-de1d-4b3e-9444-a3e938c8081d"">150120</a>",Equine,165A,Intervet Inc.,Merck Animal Health,"Equine Influenza Vaccine, Modified Live Virus","Influenza Virus, Equine",Flu Avert I.N.,No distributor specified,"A vaccine for equines that helps protect against influenza virus, equine.",Label not found in quick search; please consult the USDA/APHIS product summary or the manufacturer's product insert for exact dosage and schedule.,Label not located,"A vaccine for equines that helps protect against influenza virus, equine."
"<a href=""https://www.aphis.usda.govhttps://www.aphis.usda.gov/aphis/ourfocus/animalhealth/veterinary-biologics/product-summaries/vet-label-data/2d50aa8f-1e6c-4a5a-a42e-a1f16cbb8f14"">446922</a>",Bovine,190,Zoetis Inc.,Not applicable,"Bovine Rhinotracheitis-Virus Diarrhea-Parainfluenza 3-Respiratory Syncytial Virus Vaccine, Modified Live &amp; Killed Virus, Leptospira Canicola-Grippotyphosa-Hardjo-Icterohaemorrhagiae-Pomona Bacterin","Bovine Virus Diarrhea Virus (Untyped); Leptospira canicola; L. grippotyphosa; L. hardjo; L. icterohaemorrhagiae; L. pomona; Herpesvirus, Bovine (IBR); Parainfluenza 3 Virus, Bovine; Respiratory Syncytial Virus, Bovine",CattleMaster 4+L5,Zoetis Industria Produtos Veterinarios Ltda.; Zoetis Industria de Produtos; Zoetis Panama,"A vaccine for bovines that helps protect against bovine virus diarrhea virus (untyped); leptospira canicola; l. grippotyphosa; l. hardjo; l. icterohaemorrhagiae; l. pomona; herpesvirus, bovine (ibr); parainfluenza 3 virus, bovine; respiratory syncytial virus, bovine.","Administer by wing-web method; typical dose extremely small (e.g., 0.01 mL per bird) — follow product insert for exact technique and timing.","Merck/USDA product inserts (Tremvac, AE-Poxine).","A vaccine for bovines that helps protect against bovine virus diarrhea virus (untyped); leptospira canicola; l. grippotyphosa; l. hardjo; l. icterohaemorrhagiae; l. pomona; herpesvirus, bovine (ibr); parainfluenza 3 virus, bovine; respiratory syncytial virus, bovine."
"<a href=""https://www.aphis.usda.govhttps://www.aphis.usda.gov/aphis/ourfocus/animalhealth/veterinary-biologics/product-summaries/vet-label-data/12eaccde-babb-4db8-aa52-5b58488f7717"">15592B</a>",Feline,165A,Intervet Inc.,Merck Animal Health,"Feline Leukemia-Rhinotracheitis-Calici-Panleukopenia-Chlamydia Psittaci Vaccine, Modified Live &amp; Killed Virus, Modified Live Chlamydia","Chlamydia psittaci; Feline Leukemia Virus; Calicivirus, Feline; Herpesvirus, Feline (Rhinotracheitis); Parvovirus, Feline (Panleukopenia)",Nobivac Feline 1 HCPCh + FeLV; Nobivac HCPCh+FeLV; Nobivac: Feline 1-HCPCh+FeLV; Procyon HCPCh+FeLV; Quantum Cat HCP-Chlam + FeLV,Intervet Mexico S.A. de C.V.; MSD Salud Animal Columbia S.A.S.; Merck Sharp &amp; Dohme Saude Animal Ltda.,"A vaccine for felines that helps protect against chlamydia psittaci; feline leukemia virus; calicivirus, feline; herpesvirus, feline (rhinotracheitis); parvovirus, feline (panleukopenia).",Label not found in quick search; please consult the USDA/APHIS product summary or the manufacturer's product insert for exact dosage and schedule.,Label not located,"A vaccine for felines that helps protect against chlamydia psittaci; feline leukemia virus; calicivirus, feline; herpesvirus, feline (rhinotracheitis); parvovirus, feline (panleukopenia)."
"<a href=""https://www.aphis.usda.govhttps://www.aphis.usda.gov/aphis/ourfocus/animalhealth/veterinary-biologics/product-summaries/vet-label-data/4bf4ea57-5427-47c4-bf9d-4e2d238da2ae"">277502</a>",Swine,165A,Intervet Inc.,Merck Sharpe and Dohme (MSD),Mycoplasma Hyopneumoniae Bacterin,Mycoplasma hyopneumoniae,Myco Silencer ONCE; Porcilis Myco Silencer ONCE,Intervet Argentina S.A.; Merck Animal Health; ntervet Mexico S.A. de C.V.;  Intervet Thailand Ltd,A bacterin for swines that provides immunity against mycoplasma hyopneumoniae.,Inject 1 mL intramuscularly (IM). Often 2-dose primary series with second dose 14 days after first; follow label for herd protocols.,"Pharmgate / product inserts (MycoGard, RespiSure).",A bacterin for swines that provides immunity against mycoplasma hyopneumoniae.
"<a href=""https://www.aphis.usda.govhttps://www.aphis.usda.gov/aphis/ourfocus/animalhealth/veterinary-biologics/product-summaries/vet-label-data/3b2f483f-c8ef-49ee-b85d-8e4e3ddfefca"">16D120</a>",Feline,190,Zoetis Inc.,Not applicable,"Feline Rhinotracheitis-Calici-Panleukopenia Vaccine, Modified Live Virus","Calicivirus, Feline; Herpesvirus, Feline (Rhinotracheitis); Parvovirus, Feline (Panleukopenia)",Feline Guard 3; Felocell 3; Felocell CVR; Vanguard Feline RCP,Zoetis Australia Pty Ltd; Zoetis Argentina; Zoetis New Zealand Ltd; Zoetis South Africa Ltd; Zoetis (Thailand) Limited; Zoetis Inc.; Zoetis Industria Produtos Veterinarios Ltda.; Zoetis Japan Inc.; Zoetis Russia; Zoetis Mexico,"A vaccine for felines that helps protect against calicivirus, feline; herpesvirus, feline (rhinotracheitis); parvovirus, feline (panleukopenia).",Label not found in quick search; please consult the USDA/APHIS product summary or the manufacturer's product insert for exact dosage and schedule.,Label not located,"A vaccine for felines that helps protect against calicivirus, feline; herpesvirus, feline (rhinotracheitis); parvovirus, feline (panleukopenia)."
"<a href=""https://www.aphis.usda.govhttps://www.aphis.usda.gov/aphis/ourfocus/animalhealth/veterinary-biologics/product-summaries/vet-label-data/7ac78b36-71ec-45b1-acdc-e4c0544422e2"">127100</a>",Chicken,190,Zoetis Inc.,Not Applicable,"Bursal Disease Vaccine, Live Virus","Bursal Disease (Birnavirus, Avian)",Bursine 3; Bursine Plus,Agrimatco Limited Algeria; SARL BIOLAB VETERINAIRE; Zoetis Animal Health Ltd - Istanbul; Zoetis Argentina; Zoetis Import Egypt; Zoetis Panama; Zoetis de Uruguay S.R.L.,"A vaccine for chickens that helps protect against bursal disease (birnavirus, avian).",Label not found in quick search; please consult the USDA/APHIS product summary or the manufacturer's product insert for exact dosage and schedule.,Label not located,"A vaccine for chickens that helps protect against bursal disease (birnavirus, avian)."
